purchase_make,purchase_model,purchase_vehicle_year,purchase_price_LB,trade_in,vehicle_financing,customer_income,customer_gender,AgeBin,made_in,job_assign,Labels
NISSAN,TITAN,2008,20001.0,0,1,20001 - 40000,M,Thirties,JAPAN,"Food Servers, Nonrestaurant",4
NISSAN,FRONTIER,2012,15001.0,0,1,20001 - 40000,M,Thirties,JAPAN,Home Health and Personal Care Aides,4
NISSAN,FRONTIER,2012,20001.0,0,1,40001 - 60000,F,Forties,JAPAN,Insurance Claims and Policy Processing Clerks,4
NISSAN,FRONTIER,2012,15001.0,1,1,60001 - 80000,M,Forties,JAPAN,Artists and Related Workers,4
NISSAN,FRONTIER,2012,15001.0,0,1,40001 - 60000,M,Sixties,JAPAN,Animal Breeders,4
TOYOTA,TACOMA,2007,20001.0,0,1,60001 - 80000,M,Forties,JAPAN,Financial Specialists,4
TOYOTA,TACOMA,2002,10001.0,0,1,20001 - 40000,F,Thirties,JAPAN,Food Preparation Workers,4
TOYOTA,TACOMA,2008,10001.0,0,1,20001 - 40000,M,Twenties,JAPAN,Septic Tank Servicers and Sewer Pipe Cleaners,4
TOYOTA,TUNDRA,2010,20001.0,0,1,20001 - 40000,M,Thirties,JAPAN,"Woodworking Machine Setters, Operators, and Tenders",4
NISSAN,FRONTIER,2007,15001.0,1,1,40001 - 60000,M,Fifties,JAPAN,"Layout Workers, Metal and Plastic",4
NISSAN,FRONTIER,2005,10001.0,0,1,60001 - 80000,M,Thirties,JAPAN,Boilermakers,4
NISSAN,TITAN,2006,10001.0,0,1,20001 - 40000,M,Twenties,JAPAN,"Grinding, Lapping, Polishing, and Buffing Machine Tool Setters, Operators, and Tenders, Metal and Plastic",4
TOYOTA,TUNDRA,2009,20001.0,1,1,60001 - 80000,M,Thirties,JAPAN,"Social Workers, All Other",4
TOYOTA,TACOMA,2012,20001.0,0,1,80001 - 100000,M,Fifties,JAPAN,Computer Systems Analysts,4
NISSAN,FRONTIER,2011,15001.0,0,1,40001 - 60000,M,Twenties,JAPAN,First-Line Supervisors of Housekeeping and Janitorial Workers,4
TOYOTA,TACOMA,2008,15001.0,1,1,20001 - 40000,M,Forties,JAPAN,Amusement and Recreation Attendants,4
TOYOTA,TACOMA,2010,25001.0,0,1,100001 - 120000,M,Forties,JAPAN,Sales Engineers,4
MITSUBISHI,RAIDER,2006,10001.0,1,1,40001 - 60000,M,Thirties,JAPAN,"Installation, Maintenance, and Repair Occupations",4
NISSAN,TITAN,2005,15001.0,0,1,40001 - 60000,M,Thirties,JAPAN,Traffic Technicians,4
NISSAN,FRONTIER,2008,15001.0,1,1,40001 - 60000,M,Forties,JAPAN,Fundraisers,4
HONDA,RIDGELINE,2011,20001.0,0,1,40001 - 60000,U,Twenties,JAPAN,Medical Equipment Repairers,4
TOYOTA,TACOMA,2009,20001.0,1,1,60001 - 80000,M,Thirties,JAPAN,Agricultural and Food Scientists,4
NISSAN,TITAN,2007,15001.0,0,1,20001 - 40000,M,Forties,JAPAN,"Packers and Packagers, Hand",4
NISSAN,FRONTIER,2005,15001.0,0,1,80001 - 100000,M,Fifties,JAPAN,"Architects, Except Landscape and Naval",4
TOYOTA,TACOMA,2012,15001.0,0,1,?,M,Forties,JAPAN,"Production Workers, All Other",4
TOYOTA,TUNDRA,2004,15001.0,0,1,60001 - 80000,M,Thirties,JAPAN,"Mathematical Science Teachers, Postsecondary",4
TOYOTA,TUNDRA,2006,15001.0,1,1,60001 - 80000,M,Thirties,JAPAN,"Criminal Justice and Law Enforcement Teachers, Postsecondary",4
TOYOTA,TACOMA,2012,25001.0,0,1,100001 - 120000,M,Forties,JAPAN,General and Operations Managers,4
TOYOTA,TACOMA,2011,20001.0,1,1,20001 - 40000,M,Sixties,JAPAN,"Textile Machine Setters, Operators, and Tenders",4
TOYOTA,TACOMA,2011,15001.0,1,1,40001 - 60000,M,Forties,JAPAN,"Painters, Construction and Maintenance",4
TOYOTA,TACOMA,2012,15001.0,1,1,140001 - 160000,M,Fifties,JAPAN,Computer and Information Systems Managers,4
TOYOTA,TACOMA,2010,20001.0,1,1,20001 - 40000,M,Fifties,JAPAN,Counter and Rental Clerks and Parts Salespersons,4
TOYOTA,TUNDRA,2011,20001.0,1,1,40001 - 60000,M,Forties,JAPAN,"Information and Record Clerks, All Other",4
NISSAN,TITAN,2005,10001.0,0,1,20001 - 40000,M,Twenties,JAPAN,"Paper Goods Machine Setters, Operators, and Tenders",4
TOYOTA,TACOMA,2010,15001.0,0,1,200001+,M,Fifties,JAPAN,"Physicians, All Other; and Ophthalmologists, Except Pediatric",4
TOYOTA,TUNDRA,2008,20001.0,1,1,80001 - 100000,M,Forties,JAPAN,"Engineers, All Other",4
NISSAN,FRONTIER,2008,15001.0,0,1,40001 - 60000,M,Forties,JAPAN,Advertising Sales Agents,4
TOYOTA,TUNDRA,2008,20001.0,0,1,60001 - 80000,F,Twenties,JAPAN,Gas Compressor and Gas Pumping Station Operators,4
TOYOTA,TACOMA,2007,15001.0,0,1,20001 - 40000,M,Twenties,JAPAN,Social and Human Service Assistants,4
HONDA,RIDGELINE,2006,15001.0,1,1,140001 - 160000,U,Fifties,JAPAN,"Dentists, All Other Specialists",4
TOYOTA,TUNDRA,2008,25001.0,1,1,80001 - 100000,M,Twenties,JAPAN,Commercial Pilots,4
TOYOTA,TACOMA,2009,15001.0,0,1,40001 - 60000,F,Forties,JAPAN,Machinists,4
HONDA,RIDGELINE,2007,10001.0,0,1,40001 - 60000,M,Fifties,JAPAN,"Metal Furnace Operators, Tenders, Pourers, and Casters",4
TOYOTA,TUNDRA,2007,15001.0,1,1,20001 - 40000,M,Forties,JAPAN,"Material Moving Workers, All Other",4
NISSAN,FRONTIER,2012,20001.0,1,1,80001 - 100000,M,Fifties,JAPAN,"Environmental Science Teachers, Postsecondary",4
TOYOTA,TUNDRA,2011,20001.0,0,1,60001 - 80000,M,Forties,JAPAN,Loan Officers,4
TOYOTA,TUNDRA,2007,15001.0,0,1,40001 - 60000,M,Forties,JAPAN,Electricians,4
TOYOTA,TACOMA,2004,10001.0,0,1,60001 - 80000,M,Forties,JAPAN,"Arts, Communications, History, and Humanities Teachers, Postsecondary",4
TOYOTA,TUNDRA,2011,25001.0,0,1,200001+,M,Forties,JAPAN,"Physicians, All Other; and Ophthalmologists, Except Pediatric",4
TOYOTA,TUNDRA,2008,20001.0,0,1,40001 - 60000,F,Fifties,JAPAN,Costume Attendants,4
TOYOTA,TACOMA,2011,20001.0,0,1,60001 - 80000,F,Fifties,JAPAN,Environmental Scientists and Geoscientists,4
HONDA,RIDGELINE,2007,15001.0,1,1,140001 - 160000,M,Fifties,JAPAN,"Dentists, All Other Specialists",4
NISSAN,TITAN,2009,20001.0,1,1,40001 - 60000,F,Fifties,JAPAN,First-Line Supervisors of Transportation and Material Moving Workers,4
TOYOTA,TACOMA,2009,15001.0,1,1,20001 - 40000,M,UnderTwenty,JAPAN,"Interviewers, Except Eligibility and Loan",4
TOYOTA,TUNDRA,2010,20001.0,1,1,20001 - 40000,M,Fifties,JAPAN,"Maintenance and Repair Workers, General",4
TOYOTA,TACOMA,2006,15001.0,1,1,40001 - 60000,M,Forties,JAPAN,Engine and Other Machine Assemblers,4
TOYOTA,TUNDRA,2012,25001.0,1,1,140001 - 160000,F,HundredPlus,JAPAN,Architectural and Engineering Managers,4
NISSAN,TITAN,2007,10001.0,0,1,80001 - 100000,M,Fifties,JAPAN,Management Analysts,4
NISSAN,FRONTIER,2012,20001.0,0,1,40001 - 60000,M,Twenties,JAPAN,Museum Technicians and Conservators,4
TOYOTA,TUNDRA,2008,20001.0,1,1,40001 - 60000,M,Thirties,JAPAN,First-Line Supervisors of Transportation and Material Moving Workers,4
TOYOTA,TUNDRA,2007,15001.0,0,1,60001 - 80000,M,Thirties,JAPAN,Locomotive Engineers and Operators,4
NISSAN,TITAN,2005,15001.0,1,1,40001 - 60000,M,Thirties,JAPAN,Procurement Clerks,4
NISSAN,TITAN,2006,15001.0,0,1,40001 - 60000,M,Thirties,JAPAN,Hoist and Winch Operators,4
TOYOTA,TUNDRA,2010,20001.0,0,1,80001 - 100000,M,Fifties,JAPAN,Statisticians,4
TOYOTA,TUNDRA,2012,25001.0,1,1,160001 - 180000,M,Fifties,JAPAN,"Pediatricians, General",4
NISSAN,FRONTIER,2008,15001.0,0,1,20001 - 40000,U,UnderTwenty,JAPAN,File Clerks,4
TOYOTA,TACOMA,2011,20001.0,0,1,40001 - 60000,M,Twenties,JAPAN,"Educational Instruction and Library Workers, All Other",4
TOYOTA,TUNDRA,2006,20001.0,1,1,140001 - 160000,M,Fifties,JAPAN,Dentists,4
TOYOTA,TACOMA,2011,25001.0,1,1,120001 - 140000,M,Forties,JAPAN,Sales Managers,4
TOYOTA,TUNDRA,2011,20001.0,1,1,0 - 20000,M,Thirties,JAPAN,"Substitute Teachers, Short-Term",4
NISSAN,FRONTIER,2006,10001.0,0,1,40001 - 60000,U,Forties,JAPAN,"Material Recording, Scheduling, Dispatching, and Distributing Workers",4
TOYOTA,TUNDRA,2007,25001.0,1,1,120001 - 140000,M,Forties,JAPAN,"Advertising, Marketing, Promotions, Public Relations, and Sales Managers",4
TOYOTA,TACOMA,2005,15001.0,0,1,100001 - 120000,M,Sixties,JAPAN,Sales Engineers,4
NISSAN,FRONTIER,2010,20001.0,1,1,60001 - 80000,M,Seventies,JAPAN,Electrical and Electronic Engineering Technologists and Technicians,4
TOYOTA,TACOMA,2012,25001.0,1,1,60001 - 80000,F,Thirties,JAPAN,"Criminal Justice and Law Enforcement Teachers, Postsecondary",4
TOYOTA,TACOMA,2007,20001.0,1,1,80001 - 100000,M,Forties,JAPAN,"Social Sciences Teachers, Postsecondary",4
TOYOTA,TACOMA,2004,15001.0,1,1,20001 - 40000,M,Forties,JAPAN,Refuse and Recyclable Material Collectors,4
TOYOTA,TUNDRA,2007,20001.0,1,1,60001 - 80000,M,Twenties,JAPAN,"Compensation, Benefits, and Job Analysis Specialists",4
TOYOTA,TACOMA,2013,15001.0,0,1,80001 - 100000,M,Twenties,JAPAN,Miscellaneous Social Scientists and Related Workers,4
TOYOTA,TUNDRA,2011,30001.0,1,1,80001 - 100000,M,Fifties,JAPAN,Civil Engineers,4
TOYOTA,TACOMA,2008,20001.0,0,1,80001 - 100000,F,Fifties,JAPAN,Industrial-Organizational Psychologists,4
TOYOTA,TUNDRA,2006,15001.0,0,1,20001 - 40000,M,Thirties,JAPAN,"Material Moving Workers, All Other",4
TOYOTA,TACOMA,2012,20001.0,0,1,80001 - 100000,M,Thirties,JAPAN,Electrical Engineers,4
NISSAN,TITAN,2010,25001.0,1,1,80001 - 100000,M,Thirties,JAPAN,"Atmospheric, Earth, Marine, and Space Sciences Teachers, Postsecondary",4
TOYOTA,TUNDRA,2007,20001.0,1,1,60001 - 80000,M,Sixties,JAPAN,"Nursing Instructors and Teachers, Postsecondary",4
TOYOTA,TACOMA,2011,20001.0,1,1,80001 - 100000,M,Forties,JAPAN,"Political Science Teachers, Postsecondary",4
TOYOTA,TACOMA,2006,20001.0,1,1,20001 - 40000,M,Thirties,JAPAN,Building Cleaning and Pest Control Workers,4
NISSAN,FRONTIER,2011,20001.0,1,1,40001 - 60000,M,Forties,JAPAN,Paralegals and Legal Assistants,4
NISSAN,FRONTIER,2009,20001.0,0,1,40001 - 60000,M,Forties,JAPAN,"Archivists, Curators, and Museum Technicians",4
NISSAN,FRONTIER,2006,15001.0,0,1,40001 - 60000,M,Forties,JAPAN,First-Line Supervisors of Office and Administrative Support Workers,4
TOYOTA,TACOMA,2005,15001.0,1,1,200001+,M,Thirties,JAPAN,Family Medicine Physicians,4
NISSAN,FRONTIER,2005,10001.0,1,1,20001 - 40000,M,Sixties,JAPAN,Transportation and Material Moving Occupations,4
TOYOTA,TUNDRA,2006,15001.0,0,1,20001 - 40000,M,Forties,JAPAN,Models,4
NISSAN,FRONTIER,2004,15001.0,0,1,100001 - 120000,M,Fifties,JAPAN,Industrial Production Managers,4
TOYOTA,TACOMA,2011,15001.0,0,1,60001 - 80000,M,Forties,JAPAN,Rail Transportation Workers,4
TOYOTA,TUNDRA,2011,20001.0,0,1,20001 - 40000,F,Thirties,JAPAN,"Pressers, Textile, Garment, and Related Materials",4
TOYOTA,TUNDRA,2008,20001.0,0,1,40001 - 60000,F,Forties,JAPAN,Computer Numerically Controlled Tool Programmers,4
TOYOTA,TACOMA,2006,10001.0,0,1,0 - 20000,M,Seventies,JAPAN,Cooks,4
TOYOTA,TACOMA,2003,15001.0,0,1,80001 - 100000,M,Forties,JAPAN,"Architects, Except Landscape and Naval",4
HONDA,RIDGELINE,2010,20001.0,1,1,120001 - 140000,M,Fifties,JAPAN,Political Scientists,4
TOYOTA,TACOMA,2012,20001.0,1,1,40001 - 60000,F,Thirties,JAPAN,Precision Instrument and Equipment Repairers,4
TOYOTA,TUNDRA,2003,10001.0,0,1,20001 - 40000,M,Thirties,JAPAN,"Pressers, Textile, Garment, and Related Materials",4
TOYOTA,TACOMA,2013,20001.0,1,1,40001 - 60000,M,Twenties,JAPAN,Law Enforcement Workers,4
TOYOTA,TACOMA,2013,25001.0,1,1,20001 - 40000,M,Forties,JAPAN,Correspondence Clerks,4
NISSAN,TITAN,2010,20001.0,1,1,60001 - 80000,M,Thirties,JAPAN,Ship Engineers,4
HONDA,RIDGELINE,2008,20001.0,1,1,40001 - 60000,M,Fifties,JAPAN,Payroll and Timekeeping Clerks,4
TOYOTA,TUNDRA,2010,25001.0,0,1,80001 - 100000,M,Forties,JAPAN,Administrative Services and Facilities Managers,4
NISSAN,FRONTIER,2006,10001.0,0,1,20001 - 40000,M,UnderTwenty,JAPAN,Dental and Ophthalmic Laboratory Technicians and Medical Appliance Technicians,4
TOYOTA,TUNDRA,2012,25001.0,0,1,80001 - 100000,M,Forties,JAPAN,Legal Occupations,4
NISSAN,FRONTIER,2010,15001.0,0,1,40001 - 60000,M,Forties,JAPAN,Structural Metal Fabricators and Fitters,4
TOYOTA,TUNDRA,2005,15001.0,1,1,60001 - 80000,F,Forties,JAPAN,Special Effects Artists and Animators,4
NISSAN,FRONTIER,2012,20001.0,0,1,0 - 20000,F,Sixties,JAPAN,Tour and Travel Guides,4
NISSAN,TITAN,2004,15001.0,1,1,20001 - 40000,M,Thirties,JAPAN,"Gambling Service Workers, All Other",4
TOYOTA,TACOMA,2007,15001.0,1,1,60001 - 80000,M,Forties,JAPAN,"Postal Service Mail Sorters, Processors, and Processing Machine Operators",4
NISSAN,FRONTIER,2013,20001.0,1,1,40001 - 60000,F,Twenties,JAPAN,Automotive Service Technicians and Mechanics,4
TOYOTA,TUNDRA,2006,15001.0,1,1,20001 - 40000,M,Twenties,JAPAN,"Pressers, Textile, Garment, and Related Materials",4
SUZUKI,EQUATOR,2010,15001.0,0,1,60001 - 80000,M,Thirties,JAPAN,Public Relations Specialists,4
TOYOTA,TACOMA,2006,15001.0,0,1,20001 - 40000,F,Thirties,JAPAN,Personal Care and Service Occupations,4
TOYOTA,TUNDRA,2007,20001.0,1,1,20001 - 40000,M,Forties,JAPAN,Automotive Glass Installers and Repairers,4
NISSAN,FRONTIER,2007,15001.0,0,1,40001 - 60000,M,Thirties,JAPAN,Dredge Operators,4
MITSUBISHI,RAIDER,2008,15001.0,0,1,60001 - 80000,F,Forties,JAPAN,Agricultural and Food Scientists,4
TOYOTA,TUNDRA,2008,25001.0,0,1,140001 - 160000,M,Fifties,JAPAN,Architectural and Engineering Managers,4
TOYOTA,TACOMA,2013,25001.0,1,1,60001 - 80000,M,Twenties,JAPAN,Chemists,4
NISSAN,TITAN,2008,10001.0,0,1,20001 - 40000,M,Thirties,JAPAN,"Molding, Coremaking, and Casting Machine Setters, Operators, and Tenders, Metal and Plastic",4
TOYOTA,TACOMA,2012,25001.0,0,1,40001 - 60000,M,Unknown,JAPAN,Physical Therapist Assistants,4
NISSAN,TITAN,2012,20001.0,1,1,40001 - 60000,U,Fifties,JAPAN,Industrial Engineering Technologists and Technicians,4
TOYOTA,TUNDRA,2007,15001.0,1,1,20001 - 40000,M,Twenties,JAPAN,Conveyor Operators and Tenders,4
NISSAN,TITAN,2012,20001.0,1,1,40001 - 60000,U,Twenties,JAPAN,"Heating, Air Conditioning, and Refrigeration Mechanics and Installers",4
HONDA,RIDGELINE,2009,25001.0,1,1,20001 - 40000,M,Twenties,JAPAN,Cooks,4
NISSAN,FRONTIER,2011,20001.0,0,1,20001 - 40000,M,Twenties,JAPAN,"Painting, Coating, and Decorating Workers",4
TOYOTA,TACOMA,2005,10001.0,1,1,40001 - 60000,M,Thirties,JAPAN,Credit Counselors,4
TOYOTA,TUNDRA,2005,10001.0,0,1,200001+,F,Forties,JAPAN,"Physicians, All Other; and Ophthalmologists, Except Pediatric",4
TOYOTA,TUNDRA,2006,20001.0,0,1,100001 - 120000,M,UnderTwenty,JAPAN,"Software and Web Developers, Programmers, and Testers",4
NISSAN,TITAN,2008,15001.0,0,1,20001 - 40000,M,Twenties,JAPAN,"Aircraft Service Attendants and Transportation Workers, All Other",4
TOYOTA,TACOMA,2012,20001.0,1,1,200001+,M,Fifties,JAPAN,General Internal Medicine Physicians,4
NISSAN,FRONTIER,2010,20001.0,0,1,0 - 20000,U,Sixties,JAPAN,"Crematory Operators and Personal Care and Service Workers, All Other",4
TOYOTA,TACOMA,2008,10001.0,1,1,100001 - 120000,U,Twenties,JAPAN,Optometrists,4
TOYOTA,TACOMA,2010,15001.0,1,1,20001 - 40000,F,Fifties,JAPAN,Packaging and Filling Machine Operators and Tenders,4
TOYOTA,TACOMA,2009,20001.0,0,1,100001 - 120000,M,Forties,JAPAN,Nuclear Power Reactor Operators,4
TOYOTA,TUNDRA,2013,25001.0,0,1,200001+,M,Forties,JAPAN,"Physicians, All Other; and Ophthalmologists, Except Pediatric",4
NISSAN,TITAN,2009,20001.0,0,1,60001 - 80000,U,Thirties,JAPAN,"Special Education Teachers, All Other",4
NISSAN,FRONTIER,2012,20001.0,1,1,120001 - 140000,M,Forties,JAPAN,Sales Managers,4
TOYOTA,TUNDRA,2011,25001.0,1,1,140001 - 160000,F,Forties,JAPAN,Architectural and Engineering Managers,4
TOYOTA,TUNDRA,2012,25001.0,1,1,60001 - 80000,M,Thirties,JAPAN,Foresters,4
TOYOTA,TUNDRA,2011,25001.0,0,1,60001 - 80000,M,Twenties,JAPAN,"Social Workers, All Other",4
HONDA,RIDGELINE,2007,15001.0,1,1,80001 - 100000,M,Thirties,JAPAN,Agricultural Engineers,4
TOYOTA,TACOMA,2009,20001.0,0,1,20001 - 40000,F,Twenties,JAPAN,"Cooks, Fast Food",4
NISSAN,TITAN,2008,15001.0,1,1,40001 - 60000,F,Forties,JAPAN,Brokerage Clerks,4
TOYOTA,TACOMA,2013,20001.0,0,1,60001 - 80000,M,Fifties,JAPAN,Aircraft Mechanics and Service Technicians,4
TOYOTA,TACOMA,2011,25001.0,0,1,60001 - 80000,M,Fifties,JAPAN,First-Line Supervisors of Construction Trades and Extraction Workers,4
TOYOTA,TUNDRA,2010,20001.0,0,1,20001 - 40000,M,Forties,JAPAN,Photographic Process Workers and Processing Machine Operators,4
NISSAN,FRONTIER,2013,30001.0,0,1,80001 - 100000,M,Fifties,JAPAN,Bioengineers and Biomedical Engineers,4
NISSAN,TITAN,2008,20001.0,1,1,60001 - 80000,M,Thirties,JAPAN,Supervisors of Production Workers,4
TOYOTA,TACOMA,2007,15001.0,0,1,20001 - 40000,F,Fifties,JAPAN,Metal Workers and Plastic Workers,4
TOYOTA,TACOMA,2004,15001.0,0,1,20001 - 40000,M,Forties,JAPAN,Landscaping and Groundskeeping Workers,4
NISSAN,TITAN,2011,20001.0,0,1,60001 - 80000,M,Fifties,JAPAN,Chemists,4
TOYOTA,TUNDRA,2010,30001.0,1,1,60001 - 80000,M,Thirties,JAPAN,Compliance Officers,4
TOYOTA,TACOMA,2008,20001.0,1,1,0 - 20000,M,Fifties,JAPAN,Recreation Workers,4
NISSAN,TITAN,2004,15001.0,0,1,20001 - 40000,M,Twenties,JAPAN,Medical Assistants,4
TOYOTA,TACOMA,2010,20001.0,0,1,80001 - 100000,M,Forties,JAPAN,Social Scientists and Related Workers,4
TOYOTA,TUNDRA,2008,25001.0,1,1,20001 - 40000,M,Sixties,JAPAN,Cooling and Freezing Equipment Operators and Tenders,4
TOYOTA,TACOMA,2011,25001.0,0,1,20001 - 40000,M,Thirties,JAPAN,"Tutors and Teachers and Instructors, All Other",4
TOYOTA,TUNDRA,2007,20001.0,0,1,100001 - 120000,M,Thirties,JAPAN,"Economics Teachers, Postsecondary",4
TOYOTA,TUNDRA,2008,15001.0,1,1,160001 - 180000,F,Twenties,JAPAN,Nurse Anesthetists,4
NISSAN,FRONTIER,2011,25001.0,1,1,0 - 20000,M,Fifties,JAPAN,Home Health and Personal Care Aides,4
MITSUBISHI,RAIDER,2007,10001.0,0,1,40001 - 60000,M,Forties,JAPAN,Automotive Service Technicians and Mechanics,4
TOYOTA,TACOMA,2013,25001.0,0,1,20001 - 40000,M,Forties,JAPAN,Sewing Machine Operators,4
TOYOTA,TACOMA,2011,25001.0,1,1,20001 - 40000,U,Fifties,JAPAN,Correspondence Clerks,4
TOYOTA,TUNDRA,2013,30001.0,1,1,80001 - 100000,M,Fifties,JAPAN,Industrial-Organizational Psychologists,4
SUBARU,BAJA,2006,10001.0,1,1,60001 - 80000,F,Forties,JAPAN,Pile Driver Operators,4
NISSAN,FRONTIER,2010,15001.0,1,1,0 - 20000,M,Seventies,JAPAN,Animal Caretakers,4
TOYOTA,TACOMA,2005,15001.0,0,1,20001 - 40000,M,Forties,JAPAN,"Crematory Operators and Personal Care and Service Workers, All Other",4
TOYOTA,TUNDRA,2007,20001.0,0,1,60001 - 80000,M,Forties,JAPAN,Miscellaneous Healthcare Diagnosing or Treating Practitioners,4
TOYOTA,TUNDRA,2009,20001.0,0,1,40001 - 60000,U,Thirties,JAPAN,Animal Breeders,4
NISSAN,FRONTIER,2010,20001.0,1,1,200001+,M,Fifties,JAPAN,General Internal Medicine Physicians,4
TOYOTA,TACOMA,2007,20001.0,1,1,100001 - 120000,M,Thirties,JAPAN,Human Resources Managers,4
TOYOTA,TUNDRA,2007,20001.0,1,1,40001 - 60000,M,Thirties,JAPAN,Solar Photovoltaic Installers,4
TOYOTA,TUNDRA,2008,20001.0,1,1,60001 - 80000,M,Twenties,JAPAN,Aerospace Engineering and Operations Technologists and Technicians,4
NISSAN,FRONTIER,2006,15001.0,1,1,60001 - 80000,F,Fifties,JAPAN,"Life Scientists, All Other",4
NISSAN,FRONTIER,2010,20001.0,0,1,0 - 20000,M,Thirties,JAPAN,"Hotel, Motel, and Resort Desk Clerks",4
TOYOTA,TUNDRA,2003,15001.0,0,1,60001 - 80000,M,Fifties,JAPAN,Anthropologists and Archeologists,4
TOYOTA,TACOMA,2007,10001.0,0,1,80001 - 100000,M,Fifties,JAPAN,Information Security Analysts,4
TOYOTA,TUNDRA,2010,20001.0,1,1,200001+,M,Thirties,JAPAN,General Internal Medicine Physicians,4
TOYOTA,TUNDRA,2007,15001.0,0,1,40001 - 60000,M,Twenties,JAPAN,Insurance Claims and Policy Processing Clerks,4
TOYOTA,TUNDRA,2004,10001.0,0,1,20001 - 40000,U,Forties,JAPAN,"Interviewers, Except Eligibility and Loan",4
TOYOTA,TACOMA,2010,20001.0,1,1,40001 - 60000,M,Thirties,JAPAN,"Pipelayers, Plumbers, Pipefitters, and Steamfitters",4
NISSAN,FRONTIER,2011,15001.0,1,1,60001 - 80000,M,Forties,JAPAN,"Chemistry Teachers, Postsecondary",4
TOYOTA,TUNDRA,2010,20001.0,1,1,40001 - 60000,F,Forties,JAPAN,Lodging Managers,4
TOYOTA,TUNDRA,2010,25001.0,1,1,60001 - 80000,M,Fifties,JAPAN,Training and Development Specialists,4
HONDA,RIDGELINE,2006,15001.0,1,1,0 - 20000,M,Twenties,JAPAN,Legislators,4
NISSAN,FRONTIER,2007,10001.0,0,1,40001 - 60000,M,Twenties,JAPAN,Computer Numerically Controlled Tool Operators and Programmers,4
TOYOTA,TUNDRA,2005,15001.0,1,1,20001 - 40000,M,Forties,JAPAN,Cutting Workers,4
TOYOTA,TACOMA,2009,25001.0,1,1,100001 - 120000,F,Fifties,JAPAN,Chemical Engineers,4
TOYOTA,TUNDRA,2002,10001.0,1,1,80001 - 100000,M,Thirties,JAPAN,"Geography Teachers, Postsecondary",4
TOYOTA,TUNDRA,2006,15001.0,0,1,120001 - 140000,M,Seventies,JAPAN,Aircraft Pilots and Flight Engineers,4
TOYOTA,TUNDRA,2006,10001.0,0,1,40001 - 60000,F,Forties,JAPAN,Control and Valve Installers and Repairers,4
NISSAN,TITAN,2012,25001.0,1,1,120001 - 140000,F,Forties,JAPAN,Natural Sciences Managers,4
NISSAN,FRONTIER,2012,15001.0,1,1,40001 - 60000,M,Forties,JAPAN,Engine and Other Machine Assemblers,4
TOYOTA,TACOMA,2006,20001.0,0,1,80001 - 100000,M,Forties,JAPAN,Operations Research Analysts,4
NISSAN,TITAN,2010,20001.0,0,1,60001 - 80000,M,Thirties,JAPAN,Occupational Health and Safety Specialists,4
NISSAN,FRONTIER,2012,20001.0,0,1,20001 - 40000,M,Forties,JAPAN,Food and Beverage Serving Workers,4
TOYOTA,TUNDRA,2010,25001.0,1,1,160001 - 180000,M,Thirties,JAPAN,Nurse Anesthetists,4
TOYOTA,TACOMA,2012,25001.0,1,1,80001 - 100000,M,Sixties,JAPAN,Marine Engineers and Naval Architects,4
TOYOTA,TACOMA,2008,15001.0,0,1,120001 - 140000,U,Fifties,JAPAN,Podiatrists,4
TOYOTA,TACOMA,2006,15001.0,0,1,20001 - 40000,U,Sixties,JAPAN,"Miscellaneous Vehicle and Mobile Equipment Mechanics, Installers, and Repairers",4
NISSAN,TITAN,2006,10001.0,0,1,40001 - 60000,M,Unknown,JAPAN,"Life, Physical, and Social Science Technicians",4
TOYOTA,TUNDRA,2012,30001.0,0,1,40001 - 60000,U,Forties,JAPAN,"Precision Instrument and Equipment Repairers, All Other",4
TOYOTA,TACOMA,2003,15001.0,1,1,60001 - 80000,M,Fifties,JAPAN,"Psychology Teachers, Postsecondary",4
NISSAN,TITAN,2005,10001.0,1,1,40001 - 60000,F,Thirties,JAPAN,Motorboat Operators,4
TOYOTA,TACOMA,2004,10001.0,1,1,80001 - 100000,M,Forties,JAPAN,Engineers,4
NISSAN,TITAN,2012,25001.0,0,1,120001 - 140000,M,Forties,JAPAN,Financial Managers,4
HONDA,RIDGELINE,2006,15001.0,0,1,40001 - 60000,M,Forties,JAPAN,Insurance Sales Agents,4
NISSAN,TITAN,2006,15001.0,1,1,80001 - 100000,M,Twenties,JAPAN,Financial Examiners,4
NISSAN,FRONTIER,2012,15001.0,0,1,20001 - 40000,M,Sixties,JAPAN,Sewing Machine Operators,4
NISSAN,TITAN,2008,15001.0,0,1,40001 - 60000,F,Forties,JAPAN,Mechanical Door Repairers,4
TOYOTA,TACOMA,2013,30001.0,0,1,40001 - 60000,M,Forties,JAPAN,"Preschool, Elementary, Middle, Secondary, and Special Education Teachers",4
NISSAN,FRONTIER,2008,15001.0,0,1,40001 - 60000,M,Forties,JAPAN,"Aircraft Structure, Surfaces, Rigging, and Systems Assemblers",4
HONDA,RIDGELINE,2007,15001.0,0,1,60001 - 80000,M,Thirties,JAPAN,"Surveyors, Cartographers, and Photogrammetrists",4
NISSAN,FRONTIER,2011,20001.0,1,1,40001 - 60000,F,Seventies,JAPAN,"Derrick, Rotary Drill, and Service Unit Operators, Oil and Gas",4
TOYOTA,TUNDRA,2011,25001.0,1,1,20001 - 40000,M,Twenties,JAPAN,Supervisors of Food Preparation and Serving Workers,4
NISSAN,FRONTIER,2005,15001.0,1,1,20001 - 40000,M,Forties,JAPAN,Food Batchmakers,4
TOYOTA,TUNDRA,2008,15001.0,0,1,40001 - 60000,M,Twenties,JAPAN,Airfield Operations Specialists,4
TOYOTA,TACOMA,2010,20001.0,0,1,100001 - 120000,M,Thirties,JAPAN,Aerospace Engineers,4
TOYOTA,TUNDRA,2010,20001.0,0,1,20001 - 40000,M,Thirties,JAPAN,Supervisors of Food Preparation and Serving Workers,4
TOYOTA,TACOMA,2009,10001.0,0,1,80001 - 100000,F,Sixties,JAPAN,Materials Engineers,4
TOYOTA,TUNDRA,2008,15001.0,0,1,60001 - 80000,M,Forties,JAPAN,Occupational Health and Safety Specialists and Technicians,4
TOYOTA,TUNDRA,2014,25001.0,1,1,160001 - 180000,M,Fifties,JAPAN,Nurse Anesthetists,4
TOYOTA,TACOMA,2013,25001.0,1,1,60001 - 80000,M,Fifties,JAPAN,Occupational Health and Safety Specialists and Technicians,4
TOYOTA,TUNDRA,2004,15001.0,1,1,80001 - 100000,M,Thirties,JAPAN,Healthcare Diagnosing or Treating Practitioners,4
NISSAN,FRONTIER,2011,20001.0,0,1,100001 - 120000,M,Fifties,JAPAN,Medical and Health Services Managers,4
TOYOTA,TACOMA,2011,25001.0,1,1,80001 - 100000,M,Thirties,JAPAN,Power Plant Operators,4
NISSAN,TITAN,2010,20001.0,1,1,0 - 20000,M,Seventies,JAPAN,"Hotel, Motel, and Resort Desk Clerks",4
TOYOTA,TACOMA,2007,15001.0,0,1,80001 - 100000,M,Thirties,JAPAN,"Physical Sciences Teachers, Postsecondary",4
TOYOTA,TUNDRA,2007,20001.0,0,1,80001 - 100000,M,Thirties,JAPAN,"Social Scientists and Related Workers, All Other",4
NISSAN,FRONTIER,2012,20001.0,1,1,40001 - 60000,U,Twenties,JAPAN,Educational Instruction and Library Occupations,4
TOYOTA,TACOMA,2009,15001.0,1,1,0 - 20000,M,Sixties,JAPAN,Floral Designers,4
NISSAN,TITAN,2007,15001.0,1,1,40001 - 60000,M,Forties,JAPAN,Bridge and Lock Tenders,4
TOYOTA,TUNDRA,2011,20001.0,1,1,40001 - 60000,M,Forties,JAPAN,"Meeting, Convention, and Event Planners",4
NISSAN,FRONTIER,2005,15001.0,0,1,60001 - 80000,M,Forties,JAPAN,"Designers, All Other",4
TOYOTA,TACOMA,2002,10001.0,0,1,20001 - 40000,M,Twenties,JAPAN,Gambling Dealers,4
NISSAN,FRONTIER,2012,25001.0,1,1,60001 - 80000,M,Sixties,JAPAN,Writers and Authors,4
TOYOTA,TACOMA,2006,15001.0,0,1,20001 - 40000,M,UnderTwenty,JAPAN,Miscellaneous Agricultural Workers,4
TOYOTA,TUNDRA,2008,20001.0,0,1,40001 - 60000,M,Thirties,JAPAN,Licensed Practical and Licensed Vocational Nurses,4
TOYOTA,TACOMA,2011,15001.0,1,1,80001 - 100000,M,Thirties,JAPAN,Statisticians,4
NISSAN,TITAN,2011,20001.0,1,1,140001 - 160000,M,Fifties,JAPAN,Dentists,4
NISSAN,FRONTIER,2010,20001.0,1,1,40001 - 60000,F,Unknown,JAPAN,"Morticians, Undertakers, and Funeral Arrangers",4
NISSAN,TITAN,2008,20001.0,0,1,60001 - 80000,F,Twenties,JAPAN,"Architects, Surveyors, and Cartographers",4
NISSAN,TITAN,2009,15001.0,1,1,20001 - 40000,M,Twenties,JAPAN,"Mail Clerks and Mail Machine Operators, Except Postal Service",4
TOYOTA,TUNDRA,2011,15001.0,0,1,40001 - 60000,F,Forties,JAPAN,Insurance Sales Agents,4
TOYOTA,TACOMA,2013,30001.0,1,1,120001 - 140000,M,Fifties,JAPAN,Advertising and Promotions Managers,4
NISSAN,TITAN,2007,15001.0,0,1,60001 - 80000,F,Thirties,JAPAN,Credit Counselors and Loan Officers,4
HONDA,RIDGELINE,2007,10001.0,0,1,40001 - 60000,F,Thirties,JAPAN,Computer Numerically Controlled Tool Operators,4
TOYOTA,TACOMA,2008,20001.0,0,1,20001 - 40000,U,Thirties,JAPAN,"Helpers, Construction Trades, All Other",4
TOYOTA,TACOMA,2012,25001.0,0,1,40001 - 60000,M,Fifties,JAPAN,Industrial Machinery Mechanics,4
TOYOTA,TUNDRA,2006,15001.0,1,1,60001 - 80000,M,Forties,JAPAN,Producers and Directors,4
